"Symbol","MarketCap","SP500 Stock","Price","Health Rating","Micro Trend Rating","Macro Trend Rating","Support","Resistance","Buy Signal","Entry Rating","Buy Signal Range","Buy at or below","Current Price Rating","Forecast Rating","Forecast Range","Volume Surge","Risk (%)","EPS","UpdateTime"
"SOFI","Large","No",18.45,"Good","Uptrend","Uptrend",15.51,18.92,"-","Hold","17.75-18.53",18.52,"High Value Zone: near resistance; pullback or reversal likely","Neutral","18.2-18.7",TRUE,7.27,0.43,"2025-06-30 19:59:00"
"HOOD","Large","No",96.55,"Good","Downtrend","Uptrend",76.83,94.24,"-","Hold","86.24-96",94.62,"High Value Zone: breakout above resistance; strong trend but watch for pullback","Neutral","95.12-98.72",TRUE,7.43,1.75,"2025-06-30 19:59:00"
"NVDA","Large","Yes",157.52,"Moderate","Mixed trend","Uptrend",145.5,158.71,"-","Hold","156.9-158.68",157.52,"High Value Zone: near resistance; pullback or reversal likely","Neutral","156.56-158.49",FALSE,5.74,3.11,"2025-06-30 19:59:00"
"NU","Large","No",13.72,"Moderate","Mixed trend","Uptrend",12.53,13.96,"-","Hold","13.29-13.66",13.58,"High Value Zone: near resistance; pullback or reversal likely","Neutral","13.54-13.9",FALSE,6.1,0.44,"2025-06-30 19:25:00"
"LCID","Mid","No",2.11,"Moderate","Mixed trend","Mixed trend",2.1,2.23,"-","Hold","2.12-2.15",2.14,"Balanced Zone: price is rising with room to resistance;","Neutral","2.09-2.13",FALSE,6.4,-1.19,"2025-06-30 19:59:00"
